"DESCRIPTION","DURATION IN MS","NAME","PARENT SUITE","START TIME","STATUS","STOP TIME","SUB SUITE","SUITE","TEST CLASS","TEST METHOD"
"","6","Test case to verify TTM integration with automation framework @SFAT-359","chromium","Fri Mar 07 12:44:20 UTC 2025","failed","Fri Mar 07 12:44:20 UTC 2025","Single Family Activations tests","ui/loginSauceLogin.spec.ts","",""
"","10672","Verify item added to cart successfully","chromium","Fri Mar 07 12:44:21 UTC 2025","passed","Fri Mar 07 12:44:31 UTC 2025","Single Family Activations tests","ui/loginSauceLogin.spec.ts","",""
"","1275","Test3 login to page @regression","chromium","Fri Mar 07 12:44:08 UTC 2025","passed","Fri Mar 07 12:44:09 UTC 2025","","ui/addToCart.spec.ts","",""
"","331","Get user details by ID and verify the response","chromium","Fri Mar 07 12:44:07 UTC 2025","failed","Fri Mar 07 12:44:07 UTC 2025","","api/users.spec.ts","",""
"","10703","Test4 add to cart","chromium","Fri Mar 07 12:44:09 UTC 2025","passed","Fri Mar 07 12:44:20 UTC 2025","","ui/addToCart.spec.ts","",""
"","262","Create a new user and verify the response","chromium","Fri Mar 07 12:44:06 UTC 2025","passed","Fri Mar 07 12:44:07 UTC 2025","","api/users.spec.ts","",""
