"DESCRIPTION","DURATION IN MS","NAME","PARENT SUITE","START TIME","STATUS","STOP TIME","SUB SUITE","SUITE","TEST CLASS","TEST METHOD"
"","250","Create a new user and verify the response","chromium","Sun Feb 23 12:44:20 UTC 2025","passed","Sun Feb 23 12:44:21 UTC 2025","","api/users.spec.ts","",""
"","345","Get user details by ID and verify the response","chromium","Sun Feb 23 12:44:21 UTC 2025","failed","Sun Feb 23 12:44:21 UTC 2025","","api/users.spec.ts","",""
"","10756","Test4 add to cart","chromium","Sun Feb 23 12:44:22 UTC 2025","passed","Sun Feb 23 12:44:33 UTC 2025","","ui/addToCart.spec.ts","",""
"","826","Test3 login to page @regression","chromium","Sun Feb 23 12:44:21 UTC 2025","passed","Sun Feb 23 12:44:22 UTC 2025","","ui/addToCart.spec.ts","",""
"","3","Test case to verify TTM integration with automation framework @SFAT-359","chromium","Sun Feb 23 12:44:33 UTC 2025","failed","Sun Feb 23 12:44:33 UTC 2025","Single Family Activations tests","ui/loginSauceLogin.spec.ts","",""
"","10716","Verify item added to cart successfully","chromium","Sun Feb 23 12:44:34 UTC 2025","passed","Sun Feb 23 12:44:45 UTC 2025","Single Family Activations tests","ui/loginSauceLogin.spec.ts","",""
